{
  "schema_version": "broker_reports_gate2_financial_decision_reason_catalog_v2",
  "catalog_id": "broker_reports_gate2_financial_decision_reason_catalog",
  "semantic_version": "2.0.0",
  "predecessor": {
    "schema_version": "broker_reports_gate2_financial_decision_reason_catalog_v1",
    "semantic_version": "1.0.0",
    "semantic_integrity_sha256": "d7290593410cafd6b35281ed3a6159802f0d7e87b7a085f3ec2cd2b46f4a3e15"
  },
  "managed_asset_family_id": "broker_reports_gate2_financial_domain_assets",
  "authority_status": "future_v2_1_candidate_not_live",
  "runtime_activation": false,
  "response_profile_status": "not_implemented",
  "family_packaging_status": "not_packaged_until_goal7",
  "lifecycle": {
    "status": "draft",
    "draft_rollback": "discard_without_runtime_mutation",
    "active_rollback": "select_previous_validated_immutable_family_version"
  },
  "locale": "en",
  "applies_to_disposition": "unclassified_financial_input",
  "selection_dimensions": [
    "plausible_distinct_available_financial_type_count",
    "uniquely_safe_prebound_choice_count"
  ],
  "gui": {
    "collection_title": "Unclassified financial decision reasons",
    "item_key": "code",
    "item_label": "human_title",
    "order_field": "display_order",
    "editable_fields": [
      "human_title",
      "meaning",
      "use_when",
      "do_not_use_when",
      "positive_example",
      "contrast_with_neighbouring_reasons"
    ],
    "immutable_fields": [
      "code",
      "selection_boundary"
    ]
  },
  "reasons": [
    {
      "code": "no_registry_type",
      "display_order": 1,
      "human_title": "No available type matches",
      "meaning": "Source-stated financial values are present, but none of the available financial type definitions matches their visible meaning. The values must remain unclassified.",
      "use_when": "Use only when the whole visible source has been compared with every available type card and every type can be ruled out by its meaning, distinctions, required semantic evidence, or counterexamples. Structurally generated typed options may still exist.",
      "do_not_use_when": "Do not use when two or more distinct types remain plausible, when one type is uniquely supported, when uncertainty concerns only values or bindings within one type, or when the input was technically classified as no_financial_input or unsupported.",
      "positive_example": "A synthetic row states Broker fee detail, CHF 42.25, and 2026-03-04; every available type card requires a different financial meaning, so all available types are ruled out.",
      "contrast_with_neighbouring_reasons": [
        {
          "reason_code": "single_registry_type_no_safe_record",
          "distinction": "single_registry_type_no_safe_record requires exactly one plausible available type but no uniquely safe complete record; no_registry_type requires zero plausible available types."
        },
        {
          "reason_code": "ambiguous_registry_type",
          "distinction": "ambiguous_registry_type requires at least two plausible distinct available types; no_registry_type requires zero plausible available types."
        }
      ],
      "selection_boundary": {
        "plausible_distinct_available_financial_type_count": {
          "minimum_inclusive": 0,
          "maximum_inclusive": 0
        },
        "uniquely_safe_prebound_choice_count": {
          "minimum_inclusive": 0,
          "maximum_inclusive": 0
        }
      }
    },
    {
      "code": "single_registry_type_no_safe_record",
      "display_order": 2,
      "human_title": "One matching type, no safe record",
      "meaning": "Exactly one available financial type remains plausible, but the visible source does not uniquely support one complete prebound record for that type. The values must remain unclassified.",
      "use_when": "Use only when the whole visible source rules out every other available type, yet unresolved value, association, or binding evidence prevents exactly one complete code-owned Typed Option from being selected safely.",
      "do_not_use_when": "Do not use when no available type fits, when two or more distinct types remain plausible, when exactly one complete record is safe, or when source support, scope, mapping, integrity, or transport failed technically.",
      "positive_example": "A synthetic cash-balance row contains a reporting date and currency but two indistinguishable amount references, so cash is the only plausible type and neither complete record is uniquely safe.",
      "contrast_with_neighbouring_reasons": [
        {
          "reason_code": "no_registry_type",
          "distinction": "no_registry_type requires zero plausible available types; single_registry_type_no_safe_record requires exactly one plausible type and no uniquely safe complete record."
        },
        {
          "reason_code": "ambiguous_registry_type",
          "distinction": "ambiguous_registry_type requires at least two plausible distinct available types; single_registry_type_no_safe_record requires exactly one plausible type and uncertainty only in its complete record."
        }
      ],
      "selection_boundary": {
        "plausible_distinct_available_financial_type_count": {
          "minimum_inclusive": 1,
          "maximum_inclusive": 1
        },
        "uniquely_safe_prebound_choice_count": {
          "minimum_inclusive": 0,
          "maximum_inclusive": 0
        }
      }
    },
    {
      "code": "ambiguous_registry_type",
      "display_order": 3,
      "human_title": "Multiple available types remain plausible",
      "meaning": "Source-stated financial values are present and two or more distinct available financial type definitions remain plausible after all visible evidence is considered, so no single type can be selected safely. The values must remain unclassified.",
      "use_when": "Use only when at least two distinct available type cards still fit and the visible source lacks the discriminating evidence needed to eliminate all but one.",
      "do_not_use_when": "Do not use when no available type fits, when exactly one type is uniquely supported, when uncertainty concerns only values or bindings within one already-identified type, or merely because no typed option was compiled.",
      "positive_example": "A synthetic source provides GBP 90.10, a date, and currency but no label or other discriminator; two available type cards remain plausible and neither can be selected safely.",
      "contrast_with_neighbouring_reasons": [
        {
          "reason_code": "no_registry_type",
          "distinction": "no_registry_type requires zero plausible available types; ambiguous_registry_type requires at least two plausible distinct available types."
        },
        {
          "reason_code": "single_registry_type_no_safe_record",
          "distinction": "single_registry_type_no_safe_record requires exactly one plausible available type but no uniquely safe complete record; ambiguous_registry_type requires at least two plausible distinct available types."
        }
      ],
      "selection_boundary": {
        "plausible_distinct_available_financial_type_count": {
          "minimum_inclusive": 2,
          "maximum_inclusive": "unbounded"
        },
        "uniquely_safe_prebound_choice_count": {
          "minimum_inclusive": 0,
          "maximum_inclusive": 0
        }
      }
    }
  ],
  "integrity_sha256": "2510b57b51749a14f76b987cddaa3eea19f1bb975a97c6c089565253dc3593e9"
}
